{
   "name": "Fluid Statics 1",
   "description": "!!! Empty Description from TexConverter !!!",
   "questions": [
      "Q1-HydraulicPress",
	  "Q2-ContainerDensity",
      "Q3-Resevoir",
      "Q4-TankLevel",
      "Q5-ComplexTankPressure",
      "Q6-FreebodyDiagram01",
      "Q7-FreebodyDiagram02"
   ],
   "number": 2,
   "uid": "09e5788a-8f60-4518-8937-c67ff00be1c1"
}