{
   "name": "Question Type Demos",
   "description": "!!! Empty Description from TexConverter !!!",
   "questions": [
      "TextAnswer",
      "MultipleChoice",
	  "WhatsIncorrect01",
	  "WhatsIncorrect02",
	  "AlgorithmicAnswer",
	  "AlgorithmicAnswer02",
	  "AlgorithmicAnswer03",
	  "SymbolicEquations",
	  "MatrixResponse",
	  "CombinedQuestion"
   ],
   "number": 5,
   "uid": "ce750ea8-92dd-44dc-8d0b-05e2b674f161"
}