{
  "name": "Round Trip Demo",
  "description": "",
  "uid": "16338682-fcc3-4972-8bc1-2f702fdfdbd5",
  "questions": [
    "Multiple selection problem",
    "Multipart hybrid exercise",
    "Numerical-20260408_220141",
    "Multiple Choice-20260408_220141",
    "Text Entry-20260408_220141",
    "Symbolic",
    "Numerical",
    "Essay-20260408_220141",
    "True False-20260408_220141",
    "Matching-20260408_220141"
  ],
  "number": 1
}
